{
  "id": "ruby_rhino",
  "version": "1.0.3",
  "species": "rhinoceros",
  "anthro_ratio": 0.8,
  "descriptor": "Felted wool rhinoceros with hyper-realistic eyes and expressive posture",
  "angles": [
    "front",
    "3qL",
    "profileL",
    "back",
    "profileR",
    "3qR"
  ],
  "constraints": "no clothes by default",
  "notes": "Friendly and welcoming personality"
}